[
  {
    "field": {
      "source_name": "sample",
      "name": "ALT",
      "value_type": "string"
    },
    "name": "ALT A",
    "value": "A",
    "synonyms": [
      {
        "langu_id": "en",
        "value": "Synonym of ALT A"
      }
    ]
  },
  {
    "field": {
      "source_name": "sample",
      "name": "ALT",
      "value_type": "string"
    },
    "name": "ALT C",
    "value": "C",
    "synonyms": [
      {
        "langu_id": "en",
        "value": "Synonym of ALT C"
      }
    ]
  }
]